{
  "$schema": "https://json-schema.org/draft/2020-12/schema",
  "$id": "https://example.com/channel-targeting-agent/strategy-input.schema.json",
  "title": "StrategyInput",
  "type": "object",
  "additionalProperties": true,
  "required": ["product", "market"],
  "properties": {
    "product": { "type": "string" },
    "market": { "type": "string" },
    "locale": { "type": "string" },
    "geographies": { "type": "array", "items": { "type": "string" } },
    "industries": { "type": "array", "items": { "type": "string" } },
    "companySizes": { "type": "array", "items": { "type": "string" } },
    "companyNames": { "type": "array", "items": { "type": "string" } },
    "accountLists": { "type": "array", "items": { "type": "string" } },
    "customerLists": { "type": "array", "items": { "type": "string" } },
    "contactLists": { "type": "array", "items": { "type": "string" } },
    "websiteVisitors": { "type": "array", "items": { "type": "string" } },
    "retargetingAudiences": { "type": "array", "items": { "type": "string" } },
    "engagementAudiences": { "type": "array", "items": { "type": "string" } },
    "lookalikeSeeds": { "type": "array", "items": { "type": "string" } },
    "jobTitles": { "type": "array", "items": { "type": "string" } },
    "jobFunctions": { "type": "array", "items": { "type": "string" } },
    "seniorities": { "type": "array", "items": { "type": "string" } },
    "skills": { "type": "array", "items": { "type": "string" } },
    "interests": { "type": "array", "items": { "type": "string" } },
    "keywords": { "type": "array", "items": { "type": "string" } },
    "communities": { "type": "array", "items": { "type": "string" } },
    "placements": { "type": "array", "items": { "type": "string" } },
    "topics": { "type": "array", "items": { "type": "string" } },
    "devices": { "type": "array", "items": { "type": "string" } },
    "demographics": { "type": "array", "items": { "type": "string" } },
    "education": { "type": "array", "items": { "type": "string" } },
    "lifeEvents": { "type": "array", "items": { "type": "string" } },
    "technographics": { "type": "array", "items": { "type": "string" } },
    "intentSignals": { "type": "array", "items": { "type": "string" } },
    "pains": { "type": "array", "items": { "type": "string" } },
    "gains": { "type": "array", "items": { "type": "string" } },
    "objections": { "type": "array", "items": { "type": "string" } },
    "triggers": { "type": "array", "items": { "type": "string" } },
    "exclusions": { "type": "array", "items": { "type": "string" } },
    "negativeKeywords": { "type": "array", "items": { "type": "string" } },
    "suppressionLists": { "type": "array", "items": { "type": "string" } },
    "campaignGoal": { "type": "string" },
    "budget": { "type": "string" },
    "conversionEvent": { "type": "string" },
    "measurementThresholds": { "type": "array", "items": { "type": "string" } },
    "audienceSizingRequirements": { "type": "array", "items": { "type": "string" } },
    "preferredChannels": { "type": "array", "items": { "type": "string" } },
    "complianceConstraints": { "type": "array", "items": { "type": "string" } }
  }
}
